URL,Version,Status,OIDs,Name,Title,Descriptino,Used
http://hl7.org/fhir/participationstatus,4.0.1,draft,"2.16.840.1.113883.4.642.4.487",ParticipationStatus,ParticipationStatus,"The Participation status of an appointment.","ValueSet/sas-sos-valueset-participant-status"
http://hl7.org/fhir/slotstatus,4.0.1,draft,"2.16.840.1.113883.4.642.4.483",SlotStatus,SlotStatus,"The free/busy status of the slot.","ValueSet/slotstatus"
http://interopsante.org/fhir/CodeSystem/fr-v2-0203,1.0.1,draft,,fr-v2-0203,null,"HL7 v2 - Identifier type","ValueSet/sas-valueset-typeidentifiant"
http://terminology.hl7.org/CodeSystem/v2-0276,2.0.0,active,"2.16.840.1.113883.18.169",AppointmentReason,appointmentReason,"Code system of concepts used to describe the kind of appointment or the reason why an appointment has been scheduled.  Used in HL7 Version 2.x messaging in the ARQ segment.","ValueSet/sas-valueset-appointmentreason,ValueSet/v2-0276"
http://terminology.hl7.org/CodeSystem/v3-ActCode,9.0.0,active,"2.16.840.1.113883.5.4",ActCode,ActCode,"A code specifying the particular kind of Act that the Act-instance represents within its class.    *Constraints:* The kind of Act (e.g. physical examination, serum potassium, inpatient encounter, charge financial transaction, etc.) is specified with a code from one of several, typically external, coding systems. The coding system will depend on the class of Act, such as LOINC for observations, etc.    Conceptually, the Act.code must be a specialization of the Act.classCode. This is why the structure of ActClass domain should be reflected in the superstructure of the ActCode domain and then individual codes or externally referenced vocabularies subordinated under these domains that reflect the ActClass structure.    Act.classCode and Act.code are not modifiers of each other but the Act.code concept should really imply the Act.classCode concept. For a negative example, it is not appropriate to use an Act.code ""potassium"" together with and Act.classCode for ""laboratory observation"" to somehow mean ""potassium laboratory observation"" and then use the same Act.code for ""potassium"" together with Act.classCode for ""medication"" to mean ""substitution of potassium"". This mutually modifying use of Act.code and Act.classCode is not permitted.","ValueSet/sas-valueset-typeconsultation,ValueSet/v3-ActEncounterCode"
